{
  "$schema": "../../../schemas/enemy-abilities.schema.json",
  "schemaVersion": 1,
  "recordType": "enemy-abilities",
  "id": "voidscar-arena/enemy-abilities",
  "status": "draft",
  "validity": {
    "fromBuild": "12.1.0.69587",
    "untilBuild": null,
    "seasonId": null,
    "seasonSlug": "midnight-season-2"
  },
  "instanceMapId": 2923,
  "enemies": [
    {
      "name": "Feral Saberon",
      "npcId": 243988,
      "abilities": [
        {
          "spellId": 1249661,
          "name": "Feral Rage",
          "interruptible": false,
          "dispelType": "none",
          "enrage": true
        }
      ]
    },
    {
      "name": "Sycophantic Tarasek",
      "npcId": 243983,
      "abilities": [
        {
          "spellId": 1249661,
          "name": "Feral Rage",
          "interruptible": false,
          "dispelType": "none",
          "enrage": true
        },
        {
          "spellId": 1250043,
          "name": "Melt Armor",
          "interruptible": false,
          "dispelType": "magic",
          "enrage": false
        }
      ]
    },
    {
      "name": "Longtooth Tuskarr",
      "npcId": 243985,
      "abilities": [
        {
          "spellId": 1249661,
          "name": "Feral Rage",
          "interruptible": false,
          "dispelType": "none",
          "enrage": true
        },
        {
          "spellId": 1310319,
          "name": "Bolster",
          "interruptible": false,
          "dispelType": "none",
          "enrage": true
        }
      ]
    },
    {
      "name": "Dominated Brawler",
      "npcId": 238883,
      "abilities": [
        {
          "spellId": 1254826,
          "name": "Bloodsurge",
          "interruptible": false,
          "dispelType": "none",
          "enrage": true
        },
        {
          "spellId": 1298899,
          "name": "Demoralizing Shout",
          "interruptible": true,
          "dispelType": "none",
          "enrage": false
        }
      ]
    },
    {
      "name": "Enthralled Shaman",
      "npcId": 241496,
      "abilities": [
        {
          "spellId": 1228176,
          "name": "Lava Bolt",
          "interruptible": true,
          "dispelType": "none",
          "enrage": false
        }
      ]
    },
    {
      "name": "Voidtouched Magi",
      "npcId": 252072,
      "abilities": [
        {
          "spellId": 1299938,
          "name": "Shadowbolt Volley",
          "interruptible": true,
          "dispelType": "none",
          "enrage": false
        }
      ]
    },
    {
      "name": "Chitigoth",
      "npcId": 244260,
      "abilities": [
        {
          "spellId": 1249661,
          "name": "Feral Rage",
          "interruptible": false,
          "dispelType": "none",
          "enrage": true
        }
      ]
    },
    {
      "name": "Raging Raptor",
      "npcId": 249608,
      "abilities": [
        {
          "spellId": 1249661,
          "name": "Feral Rage",
          "interruptible": false,
          "dispelType": "none",
          "enrage": true
        }
      ]
    },
    {
      "name": "Protective Turtle",
      "npcId": 249603,
      "abilities": [
        {
          "spellId": 1249661,
          "name": "Feral Rage",
          "interruptible": false,
          "dispelType": "none",
          "enrage": true
        }
      ]
    },
    {
      "name": "Brutok",
      "npcId": 244309,
      "abilities": [
        {
          "spellId": 1249661,
          "name": "Feral Rage",
          "interruptible": false,
          "dispelType": "none",
          "enrage": true
        }
      ]
    },
    {
      "name": "Abducted Drakonid",
      "npcId": 249461,
      "abilities": [
        {
          "spellId": 1249238,
          "name": "Fire Spit",
          "interruptible": false,
          "dispelType": "magic",
          "enrage": false
        },
        {
          "spellId": 1249661,
          "name": "Feral Rage",
          "interruptible": false,
          "dispelType": "none",
          "enrage": true
        }
      ]
    },
    {
      "name": "Angry Krolusk",
      "npcId": 249590,
      "abilities": [
        {
          "spellId": 1249621,
          "name": "Violent Sand",
          "interruptible": true,
          "dispelType": "none",
          "enrage": false
        }
      ]
    },
    {
      "name": "Kilivore Screamer",
      "npcId": 243766,
      "abilities": [
        {
          "spellId": 1233398,
          "name": "Mad Shriek",
          "interruptible": true,
          "dispelType": "none",
          "enrage": false
        }
      ]
    },
    {
      "name": "Agitated Voidscythe",
      "npcId": 263228,
      "abilities": [
        {
          "spellId": 1289258,
          "name": "Corrosive Essence",
          "interruptible": false,
          "dispelType": "poison",
          "enrage": false
        }
      ]
    },
    {
      "name": "Watchful Harrower",
      "npcId": 245950,
      "abilities": [
        {
          "spellId": 1239855,
          "name": "Sky Strike",
          "interruptible": false,
          "dispelType": "magic",
          "enrage": false
        }
      ]
    },
    {
      "name": "Devouring Brutalizer",
      "npcId": 268184,
      "abilities": [
        {
          "spellId": 1310324,
          "name": "Mending Void",
          "interruptible": true,
          "dispelType": "none",
          "enrage": false
        }
      ]
    },
    {
      "name": "Voidminder",
      "npcId": 244708,
      "abilities": [
        {
          "spellId": 1310324,
          "name": "Mending Void",
          "interruptible": true,
          "dispelType": "none",
          "enrage": false
        }
      ]
    },
    {
      "name": "Atroxus",
      "npcId": 239008,
      "abilities": [
        {
          "spellId": 1226031,
          "name": "Poison Splash",
          "interruptible": false,
          "dispelType": "poison",
          "enrage": false
        },
        {
          "spellId": 1263971,
          "name": "Mind-Numbing Poison",
          "interruptible": false,
          "dispelType": "poison",
          "enrage": false
        }
      ]
    }
  ],
  "provenance": [
    {
      "kind": "game-data",
      "description": "Ability flags extracted by WHELP from Mythic Dungeon Tools 6.2.10; names are independently corroborated below.",
      "url": "https://github.com/Nnoggie/MythicDungeonTools",
      "retrievedAt": "2026-09-02T11:15:00+02:00"
    },
    { "kind": "external-reference", "description": "Spell 1249661 name corroborated against Wowhead's Feral Rage record.", "url": "https://www.wowhead.com/spell=1249661/feral-rage", "retrievedAt": "2026-09-02T14:24:00+02:00" },
    { "kind": "external-reference", "description": "Spell 1250043 name corroborated against Wowhead's Melt Armor record.", "url": "https://www.wowhead.com/spell=1250043/melt-armor", "retrievedAt": "2026-09-02T14:24:00+02:00" },
    { "kind": "external-reference", "description": "Spell 1310319 name corroborated against Wowhead's Bolster record.", "url": "https://www.wowhead.com/spell=1310319/bolster", "retrievedAt": "2026-09-02T14:24:00+02:00" },
    { "kind": "external-reference", "description": "Spell 1254826 name corroborated against Wowhead's Bloodsurge record.", "url": "https://www.wowhead.com/spell=1254826/bloodsurge", "retrievedAt": "2026-09-02T14:24:00+02:00" },
    { "kind": "external-reference", "description": "Spell 1298899 name corroborated against Wowhead's Demoralizing Shout record.", "url": "https://www.wowhead.com/spell=1298899/demoralizing-shout", "retrievedAt": "2026-09-02T14:24:00+02:00" },
    { "kind": "external-reference", "description": "Spell 1228176 name corroborated against Wowhead's Lava Bolt record.", "url": "https://www.wowhead.com/spell=1228176/lava-bolt", "retrievedAt": "2026-09-02T14:24:00+02:00" },
    { "kind": "external-reference", "description": "Spell 1299938 name corroborated against Wowhead's Shadowbolt Volley record.", "url": "https://www.wowhead.com/spell=1299938/shadowbolt-volley", "retrievedAt": "2026-09-02T14:24:00+02:00" },
    { "kind": "external-reference", "description": "Spell 1249238 name corroborated against Wowhead's Fire Spit record.", "url": "https://www.wowhead.com/spell=1249238/fire-spit", "retrievedAt": "2026-09-02T14:24:00+02:00" },
    { "kind": "external-reference", "description": "Spell 1249621 name corroborated against Wowhead's Violent Sand record.", "url": "https://www.wowhead.com/spell=1249621/violent-sand", "retrievedAt": "2026-09-02T14:24:00+02:00" },
    { "kind": "external-reference", "description": "Spell 1233398 name corroborated against Wowhead's Mad Shriek record.", "url": "https://www.wowhead.com/spell=1233398/mad-shriek", "retrievedAt": "2026-09-02T14:24:00+02:00" },
    { "kind": "external-reference", "description": "Spell 1289258 name corroborated against Wowhead's Corrosive Essence record.", "url": "https://www.wowhead.com/spell=1289258/corrosive-essence", "retrievedAt": "2026-09-02T14:24:00+02:00" },
    { "kind": "external-reference", "description": "Spell 1239855 name corroborated against Wowhead's Sky Strike record.", "url": "https://www.wowhead.com/spell=1239855/sky-strike", "retrievedAt": "2026-09-02T14:24:00+02:00" },
    { "kind": "external-reference", "description": "Spell 1310324 name corroborated against Wowhead's Mending Void record.", "url": "https://www.wowhead.com/spell=1310324/mending-void", "retrievedAt": "2026-09-02T14:24:00+02:00" },
    { "kind": "external-reference", "description": "Spell 1226031 name corroborated against Wowhead's Poison Splash record.", "url": "https://www.wowhead.com/spell=1226031/poison-splash", "retrievedAt": "2026-09-02T14:24:00+02:00" },
    { "kind": "external-reference", "description": "Spell 1263971 name corroborated against Wowhead's Mind-Numbing Poison record.", "url": "https://www.wowhead.com/spell=1263971/mind-numbing-poison", "retrievedAt": "2026-09-02T14:24:00+02:00" }
  ]
}
